Title,Authors,Abstract,Published Year,Published Month,Journal,Volume,Issue,Pages,Accession Number,DOI,Ref,Covidence #,Study,Notes,Tags
The importance of nursing homes in the spread of methicillin-resistant Staphylococcus aureus (MRSA) among hospitals.,Lee BY; Bartsch SM; Wong KF; Singh A; Avery TR; Kim DS; Brown ST; Murphy CR; Yilmaz SL; Potter MA; Huang SS,"BACKGROUND: Hospital infection control strategies and programs may not consider control of methicillin-resistant Staphylococcus aureus (MRSA) in nursing homes in a county. METHODS: Using our Regional Healthcare Ecosystem Analyst, we augmented our existing agent-based model of all hospitals in Orange County (OC), California, by adding all nursing homes and then simulated MRSA outbreaks in various health care facilities. RESULTS: The addition of nursing homes substantially changed MRSA transmission dynamics throughout the county. The presence of nursing homes substantially potentiated the effects of hospital outbreaks on other hospitals, leading to an average 46.2% (range, 3.3%-156.1%) relative increase above and beyond the impact when only hospitals are included for an outbreak in OC's largest hospital. An outbreak in the largest hospital affected all other hospitals (average 2.1% relative prevalence increase) and the majority (~90%) of nursing homes (average 3.2% relative increase) after 6 months. An outbreak in the largest nursing home had effects on multiple OC hospitals, increasing MRSA prevalence in directly connected hospitals by an average 0.3% and in hospitals not directly connected through patient transfers by an average 0.1% after 6 months. A nursing home outbreak also had some effect on MRSA prevalence in other nursing homes. CONCLUSIONS: Nursing homes, even those not connected by direct patient transfers, may be a vital component of a hospital's infection control strategy. To achieve effective control, a hospital may want to better understand how regional nursing homes and hospitals are connected through both direct and indirect (with intervening stays at home) patient sharing.",2013,Mar,Med Care,51,3,205-15,,10.1097/MLR.0b013e3182836dc2,23358388,#415,Lee 2013,"",""
Modeling the regional spread and control of vancomycin-resistant enterococci.,Lee BY; Yilmaz SL; Wong KF; Bartsch SM; Eubank S; Song Y; Avery TR; Christie R; Brown ST; Epstein JM; Parker JI; Huang SS,"BACKGROUND: Because patients can remain colonized with vancomycin-resistant enterococci (VRE) for long periods of time, VRE may spread from one health care facility to another. METHODS: Using the Regional Healthcare Ecosystem Analyst, an agent-based model of patient flow among all Orange County, California, hospitals and communities, we quantified the degree and speed at which changes in VRE colonization prevalence in a hospital may affect prevalence in other Orange County hospitals. RESULTS: A sustained 10% increase in VRE colonization prevalence in any 1 hospital caused a 2.8% (none to 62%) average relative increase in VRE prevalence in all other hospitals. Effects took from 1.5 to >10 years to fully manifest. Larger hospitals tended to have greater affect on other hospitals. CONCLUSIONS: When monitoring and controlling VRE, decision makers may want to account for regional effects. Knowing a hospital's connections with other health care facilities via patient sharing can help determine which hospitals to include in a surveillance or control program.",2013,Aug,Am J Infect Control,41,8,668-73,,10.1016/j.ajic.2013.01.013,23896284,#418,Lee 2013,"",""
The spread and control of norovirus outbreaks among hospitals in a region: a simulation model.,Bartsch SM; Huang SS; Wong KF; Avery TR; Lee BY,"BACKGROUND: Because hospitals in a region are connected via patient sharing, a norovirus outbreak in one hospital may spread to others. METHODS: We utilized our Regional Healthcare Ecosystem Analyst software to generate an agent-based model of all the acute care facilities in Orange County (OC), California and simulated various norovirus outbreaks in different locations, both with and without contact precautions. RESULTS: At the lower end of norovirus reproductive rate (R0) estimates (1.64), an outbreak tended to remain confined to the originating hospital (≤6.1% probability of spread). However, at the higher end of R0 (3.74), an outbreak spread 4.1%-17.5% of the time to almost all other OC hospitals within 30 days, regardless of the originating hospital. Implementing contact precautions for all symptomatic cases reduced the probability of spread to other hospitals within 30 days and the total number of cases countywide, but not the number of other hospitals seeing norovirus cases. CONCLUSIONS: A single norovirus outbreak can continue to percolate throughout a system of different hospitals for several months and appear as a series of unrelated outbreaks, highlighting the need for hospitals within a region to more aggressively and cooperatively track and control an initial outbreak.",2014,Sep,Open Forum Infect Dis,1,2,ofu030,,10.1093/ofid/ofu030,25734110,#431,Bartsch 2014,"",""
Dispersal of antibiotic-resistant high-risk clones by hospital networks: changing the patient direction can make all the difference.,Donker T; Wallinga J; Grundmann H,"BACKGROUND: Patients who seek treatment in hospitals can introduce high-risk clones of hospital-acquired, antibiotic-resistant pathogens from previous admissions. In this manner, different healthcare institutions become linked epidemiologically. All links combined form the national patient referral network, through which high-risk clones can propagate. AIM: To assess the influence of changes in referral patterns and network structure on the dispersal of these pathogens. METHODS: Hospital admission data were mapped to reconstruct the English patient referral network, and 12 geographically distinct healthcare collectives were identified. The number of patients admitted and referred to hospitals outside their collective was measured. Simulation models were used to assess the influence of changing network structure on the spread of hospital-acquired pathogens. FINDINGS: Simulation models showed that decreasing the number of between-collective referrals by redirecting, on average, just 1.5 patients/hospital/day had a strong effect on dispersal. By decreasing the number of between-collective referrals, the spread of high-risk clones through the network can be reduced by 36%. Conversely, by creating supra-regional specialist centres that provide specialist care at national level, the rate of dispersal can increase by 48%. CONCLUSION: The structure of the patient referral network has a profound effect on the epidemic behaviour of high-risk clones. Any changes that affect the number of referrals between healthcare collectives, inevitably affect the national dispersal of these pathogens. These effects should be taken into account when creating national specialist centres, which may jeopardize control efforts.",2014,Jan,J Hosp Infect,86,1,34-41,,10.1016/j.jhin.2013.06.021,24075292,#440,Donker 2014,"",""
The relative importance of large problems far away versus small problems closer to home: insights into limiting the spread of antimicrobial resistance in England.,Donker T; Henderson KL; Hopkins KL; Dodgson AR; Thomas S; Crook DW; Peto TEA; Johnson AP; Woodford N; Walker AS; Robotham JV,"BACKGROUND: To combat the spread of antimicrobial resistance (AMR), hospitals are advised to screen high-risk patients for carriage of antibiotic-resistant bacteria on admission. This often includes patients previously admitted to hospitals with a high AMR prevalence. However, the ability of such a strategy to identify introductions (and hence prevent onward transmission) is unclear, as it depends on AMR prevalence in each hospital, the number of patients moving between hospitals, and the number of hospitals considered 'high risk'. METHODS: We tracked patient movements using data from the National Health Service of England Hospital Episode Statistics and estimated differences in regional AMR prevalences using, as an exemplar, data collected through the national reference laboratory service of Public Health England on carbapenemase-producing Enterobacteriaceae (CPE) from 2008 to 2014. Combining these datasets, we calculated expected CPE introductions into hospitals from across the hospital network to assess the effectiveness of admission screening based on defining high-prevalence hospitals as high risk. RESULTS: Based on numbers of exchanged patients, the English hospital network can be divided into 14 referral regions. England saw a sharp increase in numbers of CPE isolates referred to the national reference laboratory over 7 years, from 26 isolates in 2008 to 1649 in 2014. Large regional differences in numbers of confirmed CPE isolates overlapped with regional structuring of patient movements between hospitals. However, despite these large differences in prevalence between regions, we estimated that hospitals received only a small proportion (1.8%) of CPE-colonised patients from hospitals outside their own region, which decreased over time. CONCLUSIONS: In contrast to the focus on import screening based on assigning a few hospitals as 'high risk', patient transfers between hospitals with small AMR problems in the same region often pose a larger absolute threat than patient transfers from hospitals in other regions with large problems, even if the prevalence in other regions is orders of magnitude higher. Because the difference in numbers of exchanged patients, between and within regions, was mostly larger than the difference in CPE prevalence, it would be more effective for hospitals to focus on their own populations or region to inform control efforts rather than focussing on problems elsewhere.",2017,Apr,BMC Med,15,1,86,,10.1186/s12916-017-0844-2,28446169,#449,Donker 2017,"",""
"Modeling the spread of methicillin-resistant Staphylococcus aureus (MRSA) outbreaks throughout the hospitals in Orange County, California.",Lee BY; McGlone SM; Wong KF; Yilmaz SL; Avery TR; Song Y; Christie R; Eubank S; Brown ST; Epstein JM; Parker JI; Burke DS; Platt R; Huang SS,"BACKGROUND: Since hospitals in a region often share patients, an outbreak of methicillin-resistant Staphylococcus aureus (MRSA) infection in one hospital could affect other hospitals. METHODS: Using extensive data collected from Orange County (OC), California, we developed a detailed agent-based model to represent patient movement among all OC hospitals. Experiments simulated MRSA outbreaks in various wards, institutions, and regions. Sensitivity analysis varied lengths of stay, intraward transmission coefficients (β), MRSA loss rate, probability of patient transfer or readmission, and time to readmission. RESULTS: Each simulated outbreak eventually affected all of the hospitals in the network, with effects depending on the outbreak size and location. Increasing MRSA prevalence at a single hospital (from 5% to 15%) resulted in a 2.9% average increase in relative prevalence at all other hospitals (ranging from no effect to 46.4%). Single-hospital intensive care unit outbreaks (modeled increase from 5% to 15%) caused a 1.4% average relative increase in all other OC hospitals (ranging from no effect to 12.7%). CONCLUSION: MRSA outbreaks may rarely be confined to a single hospital but instead may affect all of the hospitals in a region. This suggests that prevention and control strategies and policies should account for the interconnectedness of health care facilities.",2011,Jun,Infect Control Hosp Epidemiol,32,6,562-72,,10.1086/660014,21558768,#466,Lee 2011,"",""
Cross border hospital use: analysis using data linkage across four Australian states.,Spilsbury K; Rosman D; Alan J; Boyd JH; Ferrante AM; Semmens JB,"OBJECTIVE: To determine the quality and effectiveness of national data linkage capacity by performing a proof-of-concept project investigating cross-border hospital use and hospital-related deaths. DESIGN, PARTICIPANTS AND SETTING: Analysis of person-level linked hospital separation and death registration data of all public and private hospital patients in New South Wales, Queensland and Western Australia and of public hospital patients in South Australia, totalling 7.7 million hospital patients from 1 July 2004 to 30 June 2009. MAIN OUTCOME MEASURES: Counts and proportions of hospital stays and patient movement patterns. RESULTS: 223 262 patients (3.0%) travelled across a state border to attend hospitals, in particular, far northern and western NSW patients travelling to Queensland and SA hospitals, respectively. A further 48 575 patients (0.6%) moved their place of residence interstate between hospital visits, particularly to and from areas associated with major mining and tourism industries. Over 11 000 cross-border hospital transfers were also identified. Of patients who travelled across a state border to hospital, 2800 (1.3%) died in that hospital. An additional 496 deaths recorded in one jurisdiction occurred within 30 days of hospital separation from another jurisdiction. CONCLUSIONS: Access to person-level data linked across jurisdictions identified geographical hot spots of cross-border hospital use and hospital-related deaths in Australia. This has implications for planning of health service delivery and for longitudinal follow-up studies, particularly those involving mobile populations.",2015,Jun,Med J Aust,202,11,582-6,,10.5694/mja14.01414,26068690,#702,Spilsbury 2015,Elise Hodbert (2025-01-09 00:18:55)(Select): à revoir; ,""
Critical care transfers and COVID-19: Managing capacity challenges through critical care networks.,Pett E; Leung HL; Taylor E; Chong MSF; Hla TTW; Sartori G; Sathianathan V; Husain T; Suntharalingam G; Rosenberg A; Walsh A; Wigmore T,"The intensive care units in North West London are part of one of the oldest critical care networks in the UK, forming a mature and established strategic alliance to share resources, experience and knowledge for the benefit of its patients. North West London saw an early surge in COVID-19 admissions, which urgently threatened the capacity of some of its intensive care units even before the UK government announced lockdown. The pre-existing relationships and culture within the network allowed its members to unite and work rapidly to develop agile and innovative solutions, protecting any individual unit from becoming overwhelmed, and ultimately protecting its patients. Within a short 50-day period 223 patients were transferred within the network to distribute pressures. This unprecedented number of critical care transfers, combined with the creation of extra capacity and new pathways, allowed the region to continue to offer timely and unrationed access to critical care for all patients who would benefit from admission. This extraordinary response is a testament to the power and benefits of a regionally networked approach to critical care, and the lessons learned may benefit other healthcare providers, managers and policy makers, especially in regions currently facing new outbreaks of COVID-19.",2022,May,J Intensive Care Soc,23,2,203-209,,10.1177/1751143720980270,35615242,#742,Pett 2022,"",""
Investigating the Temporal Dynamics of Interorganizational Exchange: Patient Transfers among Italian Hospitals.,Kitts JA; Lomi A; Mascia D; Pallotti F; Quintane E,"Previous research on interaction behavior among organizations (resource exchange, collaboration, communication) has typically aggregated those behaviors over time as a network of organizational relationships. The authors instead study structural-temporal patterns in organizational exchange, focusing on the dynamics of reciprocation. Applying this lens to a community of Italian hospitals during 2003-7, the authors observe two mechanisms of interorganizational reciprocation: organizational embedding and resource dependence. The authors show how these two mechanisms operate on distinct time horizons: dependence applies to contemporaneous exchange structures, whereas embedding develops through longer-term historical patterns. They also show how these processes operate differently in competitive and non-competitive contexts, operationalized in terms of market differentiation and geographic space. In noncompetitive contexts, the authors observe both logics of reciprocation, dependence in the short term and embedding over the long term, developing into population-level generalized exchange. In competitive contexts, they find no reciprocation and instead observe the microfoundations of status hierarchies.",2017,Nov,AJS,123,3,850-910,,10.1086/693704,34305150,#958,Kitts 2017,"",""
Using hospital network-based surveillance for antimicrobial resistance as a more robust alternative to self-reporting.,Donker T; Smieszek T; Henderson KL; Walker TM; Hope R; Johnson AP; Woodford N; Crook DW; Peto TEA; Walker AS; Robotham JV,"Hospital performance is often measured using self-reported statistics, such as the incidence of hospital-transmitted micro-organisms or those exhibiting antimicrobial resistance (AMR), encouraging hospitals with high levels to improve their performance. However, hospitals that increase screening efforts will appear to have a higher incidence and perform poorly, undermining comparison between hospitals and disincentivising testing, thus hampering infection control. We propose a surveillance system in which hospitals test patients previously discharged from other hospitals and report observed cases. Using English National Health Service (NHS) Hospital Episode Statistics data, we analysed patient movements across England and assessed the number of hospitals required to participate in such a reporting scheme to deliver robust estimates of incidence. With over 1.2 million admissions to English hospitals previously discharged from other hospitals annually, even when only a fraction of hospitals (41/155) participate (each screening at least 1000 of these admissions), the proposed surveillance system can estimate incidence across all hospitals. By reporting on other hospitals, the reporting of incidence is separated from the task of improving own performance. Therefore the incentives for increasing performance can be aligned to increase (rather than decrease) screening efforts, thus delivering both more comparable figures on the AMR problems across hospitals and improving infection control efforts.",2019,,PLoS One,14,7,e0219994,,10.1371/journal.pone.0219994,31344075,#962,Donker 2019,"",""
Insurance-Based Disparities in Stroke Center Access in California: A Network Science Approach.,Zachrison KS; Hsia RY; Schwamm LH; Yan Z; Samuels-Kalow ME; Reeves MJ; Camargo CA Jr; Onnela JP,"BACKGROUND: Our objectives were to determine whether there is an association between ischemic stroke patient insurance and likelihood of transfer overall and to a stroke center and whether hospital cluster modified the association between insurance and likelihood of stroke center transfer. METHODS: This retrospective network analysis of California data included every nonfederal hospital ischemic stroke admission from 2010 to 2017. Transfers from an emergency department to another hospital were categorized based on whether the patient was discharged from a stroke center (primary or comprehensive). We used logistic regression models to examine the relationship between insurance (private, Medicare, Medicaid, uninsured) and odds of (1) any transfer among patients initially presenting to nonstroke center hospital emergency departments and (2) transfer to a stroke center among transferred patients. We used a network clustering method to identify clusters of hospitals closely connected through transfers. Within each cluster, we quantified the difference between insurance groups with the highest and lowest proportion of transfers discharged from a stroke center. RESULTS: Of 332 995 total ischemic stroke encounters, 51% were female, 70% were ≥65 years, and 3.5% were transferred from the initial emergency department. Of 52 316 presenting to a nonstroke center, 3466 (7.1%) were transferred. Relative to privately insured patients, there were lower odds of transfer and of transfer to a stroke center among all groups (Medicare odds ratio, 0.24 [95% CI, 0.22-0.26] and 0.59 [95% CI, 0.50-0.71], Medicaid odds ratio, 0.26 [95% CI, 0.23-0.29] and odds ratio, 0.49 [95% CI, 0.38-0.62], uninsured odds ratio, 0.75 [95% CI, 0.63-0.89], and 0.72 [95% CI, 0.6-0.8], respectively). Among the 14 identified hospital clusters, insurance-based disparities in transfer varied and the lowest performing cluster (also the largest; n=2364 transfers) fully explained the insurance-based disparity in odds of stroke center transfer. CONCLUSIONS: Uninsured patients had less stroke center access through transfer than patients with insurance. This difference was largely explained by patterns in 1 particular hospital cluster.",2023,Oct,Circ Cardiovasc Qual Outcomes,16,10,e009868,,10.1161/CIRCOUTCOMES.122.009868,37746725,#1038,Zachrison 2023,"",""
Interhospital transfers among Medicare beneficiaries admitted for acute myocardial infarction at nonrevascularization hospitals.,Iwashyna TJ; Kahn JM; Hayward RA; Nallamothu BK,"BACKGROUND: Patients with acute myocardial infarction (AMI) who are admitted to hospitals without coronary revascularization are frequently transferred to hospitals with this capability, yet we know little about the basis for how such revascularization hospitals are selected. METHODS AND RESULTS: We examined interhospital transfer patterns in 71 336 AMI patients admitted to hospitals without revascularization capabilities in the 2006 Medicare claims using network analysis and regression models. A total of 31 607 (44.3%) AMI patients were transferred from 1684 nonrevascularization hospitals to 1104 revascularization hospitals. Median time to transfer was 2 days. Median transfer distance was 26.7 miles, with 96.1% within 100 miles. In 45.8% of cases, patients bypassed a closer hospital to go to a farther hospital that had a better 30-day risk standardized mortality rates. However, in 36.8% of cases, another revascularization hospital with lower 30-day risk-standardized mortality was actually closer to the original admitting nonrevascularization hospital than the observed transfer destination. Adjusted regression models demonstrated that shorter transfer distances were more common than transfers to the hospitals with lowest 30-day mortality rates. Simulations suggest that an optimized system that prioritized the transfer of AMI patients to a nearby hospital with the lowest 30-day mortality rate might produce clinically meaningful reductions in mortality. CONCLUSIONS: More than 40% of AMI patients admitted to nonrevascularization hospitals are transferred to revascularization hospitals. Many patients are not directed to nearby hospitals with the lowest 30-day risk-standardized mortality, and this may represent an opportunity for improvement.",2010,Sep,Circ Cardiovasc Qual Outcomes,3,5,468-75,,10.1161/CIRCOUTCOMES.110.957993,20682917,#1070,Iwashyna 2010,"",""
Limiting the spread of highly resistant hospital-acquired microorganisms via critical care transfers: a simulation study.,Karkada UH; Adamic LA; Kahn JM; Iwashyna TJ,"PURPOSE: Hospital-acquired infections with highly resistant organisms are an important problem among critically ill patients. Control of these organisms has largely focused within individual hospitals. We examine the extent to which transfers of critically ill patients could be a vector for the wide spread of highly resistant organisms, and compare the efficiency of different approaches to targeting infection control resources. METHODS: We analyzed the network of interhospital transfers of intensive care unit patients in 2005 US Medicare data and 2004-2006 Pennsylvania all-payer data. We simulated the spread of highly resistant hospital-acquired infections by randomly choosing a single hospital to develop a highly resistant organism and following the spread of infection or colonization throughout the network under varying strategies of infection control and varying levels of infectivity. RESULTS: Critical care transfers could spread a highly resistant organism between any two US hospitals in a median of 3 years. Hospitals varied substantially in their importance to limiting potential spread. Targeting resources to a small subset of hospitals on the basis of their position in the transfer network was 16 times more efficient than distributing infection control resources uniformly. Within any set of targeted hospitals, the best strategy for infection control heavily concentrated resources at a few particularly important hospitals, regardless of level of infectivity. CONCLUSIONS: Critical care transfers provide a plausible vector for widespread dissemination of highly resistant hospital-acquired microorganisms. Infection control efforts can be made more efficient by selectively targeting hospitals most important for transmission.",2011,Oct,Intensive Care Med,37,10,1633-40,,10.1007/s00134-011-2341-y,21850532,#1137,Karkada 2011,"",""
