Title,Authors,Abstract,Published Year,Published Month,Journal,Volume,Issue,Pages,Accession Number,DOI,Ref,Covidence #,Study,Notes,Tags
Integrated genomic and interfacility patient-transfer data reveal the transmission pathways of multidrug-resistant Klebsiella pneumoniae in a regional outbreak.,Snitkin ES; Won S; Pirani A; Lapp Z; Weinstein RA; Lolans K; Hayden MK,"Development of effective strategies to limit the proliferation of multidrug-resistant organisms requires a thorough understanding of how such organisms spread among health care facilities. We sought to uncover the chains of transmission underlying a 2008 U.S. regional outbreak of carbapenem-resistant Klebsiella pneumoniae by performing an integrated analysis of genomic and interfacility patient-transfer data. Genomic analysis yielded a high-resolution transmission network that assigned directionality to regional transmission events and discriminated between intra- and interfacility transmission when epidemiologic data were ambiguous or misleading. Examining the genomic transmission network in the context of interfacility patient transfers (patient-sharing networks) supported the role of patient transfers in driving the outbreak, with genomic analysis revealing that a small subset of patient-transfer events was sufficient to explain regional spread. Further integration of the genomic and patient-sharing networks identified one nursing home as an important bridge facility early in the outbreak-a role that was not apparent from analysis of genomic or patient-transfer data alone. Last, we found that when simulating a real-time regional outbreak, our methodology was able to accurately infer the facility at which patients acquired their infections. This approach has the potential to identify facilities with high rates of intra- or interfacility transmission, data that will be useful for triggering targeted interventions to prevent further spread of multidrug-resistant organisms.",2017,Nov,Sci Transl Med,9,417,,,10.1126/scitranslmed.aan0093,29167391,#239,Snitkin 2017,"",""
Interhospital patient transfers between Ontario's academic and large community hospitals increase the risk of Clostridium difficile infection.,DiDiodato G; McArthur L,"BACKGROUND: The objective of this study is to determine the impact of interhospital patient transfers on the risk of Clostridium difficile infection (CDI). METHODS: The number of interhospital patient transfers and CDI cases for 11 academic and 40 large community hospitals (LCHs) were available from 2010-2015. These data were used to compute a CDI score for each sending facility as a measure of CDI pressure on the receiving facility. This CDI score was included as a variable in a multilevel mixed-effect Poisson regression model of CDI cases. Other covariates included year, CDI testing strategy, antimicrobial stewardship program (ASP), and criteria used for patient isolation. Hospital-specific random effects were estimated for the baseline rate of CDI (intercept) and ASP effect (slope). RESULTS: The CDI score ranged from 0-103, with a mean score ± SD of 20.4 ± 21.8. Every 10-point increase in the CDI score was associated with a 4.5% increase in the incidence of CDI in the receiving academic hospital (95% confidence interval [CI], 0.9-8.5) and 3.6% increase in the receiving LCHs (95% CI, 0.3-7). The random components of the model varied significantly, with a strong negative correlation of -0.85 (95% CI, -0.94 to -0.65). CONCLUSIONS: Our results suggest interhospital patient transfers increase the risk of CDI. ASPs appear to reduce this risk; however, these ASP effects demonstrate significant heterogeneity across hospitals.",2018,Feb,Am J Infect Control,46,2,191-196,,10.1016/j.ajic.2017.08.018,28958443,#240,DiDiodato 2018,"",""
Assessing the role of inter-facility patient transfer in the spread of carbapenemase-producing Enterobacteriaceae: the case of France between 2012 and 2015.,Nekkab N; Crépey P; Astagneau P; Opatowski L; Temime L,"The spread of carbapenemase-producing Enterobacteriaceae (CPE) in healthcare settings is a major public health threat that has been associated with cross-border and local patient transfers between healthcare facilities. Since the impact of transfers on spread may vary, our study aimed to assess the contribution of a patient transfer network on CPE incidence and spread at a countrywide level, with a case study of France from 2012 to 2015. Our results suggest a transition in 2013 from a CPE epidemic sustained by internationally imported episodes to an epidemic sustained by local transmission events through patient transfers. Incident episodes tend to occur within close spatial distance of their potential infector. We also observe an increasing frequency of multiple spreading events, originating from a limited number of regional hubs. Consequently, coordinated prevention and infection control strategies should focus on transfers of carriers of CPE to reduce regional and inter-regional transmission.",2020,Sep,Sci Rep,10,1,14910,,10.1038/s41598-020-71212-6,32913244,#250,Nekkab 2020,"",""
Spread of Carbapenem-Resistant Enterobacteriaceae Among Illinois Healthcare Facilities: The Role of Patient Sharing.,Ray MJ; Lin MY; Weinstein RA; Trick WE,"BACKGROUND: Carbapenem-resistant Enterobacteriaceae (CRE) spread regionally throughout healthcare facilities through patient transfer and cause difficult-to-treat infections. We developed a state-wide patient-sharing matrix and applied social network analyses to determine whether greater connectedness (centrality) to other healthcare facilities and greater patient sharing with long-term acute care hospitals (LTACHs) predicted higher facility CRE rates. METHODS: We combined CRE case information from the Illinois extensively drug-resistant organism registry with measures of centrality calculated from a state-wide hospital discharge dataset to predict facility-level CRE rates, adjusting for hospital size and geographic characteristics. RESULTS: Higher CRE rates were observed among facilities with greater patient sharing, as measured by degree centrality. Each additional hospital connection (unit of degree) conferred a 6% increase in CRE rate in rural facilities (relative risk [RR] = 1.056; 95% confidence interval [CI], 1.030-1.082) and a 3% increase among Chicagoland and non-Chicago urban facilities (RR = 1.027; 95% CI, 1.002-1.052 and RR = 1.025; 95% CI, 1.002-1.048, respectively). Sharing 4 or more patients with LTACHs was associated with higher CRE rates, but this association may have been due to chance (RR = 2.08; 95% CI, .85-5.08; P = .11). CONCLUSIONS: Hospitals with greater connectedness to other hospitals in a statewide patient-sharing network had higher CRE burden. Centrality had a greater effect on CRE rates in rural counties, which do not have LTACHs. Social network analysis likely identifies hospitals at higher risk of CRE exposure, enabling focused clinical and public health interventions.",2016,Oct,Clin Infect Dis,63,7,889-93,,10.1093/cid/ciw461,27486116,#254,Ray 2016,"",""
Assessing Variation in Implantable Cardioverter Defibrillator Therapy Guideline Adherence With Physician and Hospital Patient-sharing Networks.,Moen EL; Bynum JP; Austin AM; Skinner JS; Chakraborti G; O'Malley AJ,"BACKGROUND: Implantable cardioverter defibrillator (ICD) therapy is used for primary prevention of death among people with heart failure, and new evidence in 2005 on its effectiveness changed practice guidelines in the United States. OBJECTIVES: The objective of this study is to examine how the connectedness of physicians and hospitals, measured using network analysis, relates to guideline-consistent ICD implantation. RESEARCH DESIGN: We constructed physician and hospital networks for cardiovascular disease. Physicians were linked if they shared cardiovascular disease patients; these links were aggregated by hospital affiliation to construct a hospital network. SUBJECTS: Medicare beneficiaries who underwent ICD therapy for primary prevention from 2007 to 2011. MEASURES: The clinical outcome of interest was guideline-consistent ICD implantation, calculated using the National Cardiovascular Data Registry. The exposure variables of interest were the network measures of the ICD surgeon, the referring hospital, and the hospital where the ICD surgery occurred. RESULTS: We focused on patients who were referred between hospitals for ICD implantation because they were more likely influenced by the hospital network (n=28,179). Patients were less likely to meet guidelines if their referring hospital had more connections to other hospitals (OR, 0.49; 95% confidence interval, 0.25-0.96) and more likely to meet guidelines if their ICD surgery hospital had more connections (OR, 1.61; 95% confidence interval, 0.98-2.64). The ICD surgeon's network measures were not associated with guideline-consistent implantation. CONCLUSIONS: Associations between the hospital network measures and guideline adherence suggests new approaches to better disseminate clinical guidelines across health systems.",2018,Apr,Med Care,56,4,350-357,,10.1097/MLR.0000000000000883,29419707,#255,Moen 2018,"",""
The Role of Nursing Homes in the Spread of Antimicrobial Resistance Over the Healthcare Network.,van den Dool C; Haenen A; Leenstra T; Wallinga J,"OBJECTIVE Recerntly, the role of the healthcare network, defined as a set of hospitals linked by patient transfers, has been increasingly considered in the control of antimicrobial resistance. Here, we investigate the potential impact of nursing homes on the spread of antimicrobial-resistant pathogens across the healthcare network and its importance for control strategies. METHODS Based on patient transfer data, we designed a network model representing the Dutch healthcare system of hospitals and nursing homes. We simulated the spread of an antimicrobial-resistant pathogen across the healthcare network, and we modeled transmission within institutions using a stochastic susceptible-infected-susceptible (SIS) epidemic model. Transmission between institutions followed transfers. We identified the contribution of nursing homes to the dispersal of the pathogen by comparing simulations of the network with and without nursing homes. RESULTS Our results strongly suggest that nursing homes in the Netherlands have the potential to drive and sustain epidemics across the healthcare network. Even when the daily probability of transmission in nursing homes is much lower than in hospitals, transmission of resistance can be more effective because of the much longer length of stay of patients in nursing homes. CONCLUSIONS If an antimicrobial-resistant pathogen emerges that spreads easily within nursing homes, control efforts aimed at hospitals may no longer be effective in preventing nationwide outbreaks. It is important to consider nursing homes in planning regional and national infection control and in implementing surveillance systems that monitor the spread of antimicrobial resistance. Infect Control Hosp Epidemiol 2016;37:761-767.",2016,Jul,Infect Control Hosp Epidemiol,37,7,761-7,,10.1017/ice.2016.59,27052880,#275,vandenDool 2016,"",""
Whole-Genome Sequencing To Identify Drivers of Carbapenem-Resistant Klebsiella pneumoniae Transmission within and between Regional Long-Term Acute-Care Hospitals.,Han JH; Lapp Z; Bushman F; Lautenbach E; Goldstein EJC; Mattei L; Hofstaedter CE; Kim D; Nachamkin I; Garrigan C; Jain T; Bilker W; Wolford HM; Slayton RB; Wise J; Tolomeo P; Snitkin ES,"Carbapenem-resistant Klebsiella pneumoniae (CRKP) is an antibiotic resistance threat of the highest priority. Given the limited treatment options for this multidrug-resistant organism (MDRO), there is an urgent need for targeted strategies to prevent transmission. Here, we applied whole-genome sequencing to a comprehensive collection of clinical isolates to reconstruct regional transmission pathways and analyzed this transmission network in the context of statewide patient transfer data and patient-level clinical data to identify drivers of regional transmission. We found that high regional CRKP burdens were due to a small number of regional introductions, with subsequent regional proliferation occurring via patient transfers among health care facilities. While CRKP was predicted to have been imported into each facility multiple times, there was substantial variation in the ratio of intrafacility transmission events per importation, indicating that amplification occurs unevenly across regional facilities. While myriad factors likely influence intrafacility transmission rates, an understudied one is the potential for clinical characteristics of colonized and infected patients to influence their propensity for transmission. Supporting the contribution of high-risk patients to elevated transmission rates, we observed that patients colonized and infected with CRKP in high-transmission facilities had higher rates of carbapenem use, malnutrition, and dialysis and were older. This report highlights the potential for regional infection prevention efforts that are grounded in genomic epidemiology to identify the patients and facilities that make the greatest contribution to regional MDRO prevalence, thereby facilitating the design of precision interventions of maximal impact.",2019,Nov,Antimicrob Agents Chemother,63,11,,,10.1128/AAC.01622-19,31451495,#283,Han 2019,"",""
Ward-level factors associated with methicillin-resistant Staphylococcus aureus acquisition-an electronic medical records study in Singapore.,Tun ZM; Fisher DA; Salmon S; Tam CC,"BACKGROUND: Methicillin-Resistant Staphylococcus aureus (MRSA) is endemic in hospitals worldwide. Intrahospital transfers may impact MRSA acquisition risk experienced by patients. In this study, we investigated ward characteristics and connectivity that are associated with MRSA acquisition. METHODS: We analysed electronic medical records on patient transfers and MRSA screening of in-patients at an acute-care tertiary hospital in Singapore to investigate whether ward characteristics and connectivity within a network of in-patient wards were associated with MRSA acquisition rates over a period of four years. RESULTS: Most patient transfers concentrated in a stable core network of wards. Factors associated with increased rate of MRSA acquisition were MRSA prevalence among patients transferred from other wards (rate ratio (RR): 7.74 [95% confidence interval (CI): 3.88, 15.44], additional 5 percentage point), critical care ward (RR: 1.72 [95% CI: 1.09, 2.70]) and presence of MRSA cohorting beds (RR: 1.39 [95% CI: 1.03, 1.90]. Oncology ward (RR: 0.66 [95% CI: 0.46, 0.94]) (compared to medical ward), and median length of stay (RR: 0.70 [95% CI: 0.55, 0.90], additional 1.5 days) were associated with lower acquisition rates. In addition, we found evidence of interaction between MRSA prevalence among patients transferred from other wards and weighted in-degree although the latter was not associated with MRSA acquisition after controlling for confounders. CONCLUSION: Wards with higher MRSA prevalence among patients transferred from other wards were more likely to have higher MRSA acquisition rate. Its effect further increased in wards receiving greater number of patients. In addition, critical care ward, presence of MRSA cohorting beds, ward specialty, and median length of stay were associated with MRSA acquisition.",2021,,PLoS One,16,7,e0254852,,10.1371/journal.pone.0254852,34292998,#317,Tun 2021,"",""
Uncharted paths: hospital networks in critical care.,Iwashyna TJ; Christie JD; Kahn JM; Asch DA,"Wide variation between hospitals in the quality of critical care lead to many potentially avoidable deaths. Regionalization of critical care is a possible solution; regionalization has been implemented for trauma and neonatal intensive care, and it is under active discussion for medical and cardiac critical care. However, regionalization is only one possible approach to reorganizing critical care services. This commentary introduces the technique of network analysis as a framework for the following: (1) understanding how critically ill patients move between hospitals, (2) defining the roles hospitals play in regional care delivery, and (3) suggesting systematic improvements that may benefit population health. We examined transfers of critically ill Medicare patients in Connecticut in 2005 as a model system. We found that patients are systematically transferred to more capable hospitals. However, we find the standard distinction of hospitals into either ""secondary hospitals"" or ""tertiary hospitals"" poorly explains observed transfer patterns; instead, hospitals show a continuum of roles. We further examine the implications of the network pattern in a simulation of quarantine of a hospital to incoming transfers, as occurred during the severe acute respiratory syndrome epidemic. Network perspectives offer new ways to study systems to care for critically ill patients and provide additional tools for addressing pragmatic problems in triage and bed management, regionalization, quality improvement, and disaster preparedness.",2009,Mar,Chest,135,3,827-833,,10.1378/chest.08-1052,19265091,#341,Iwashyna 2009,"",""
The structure of critical care transfer networks.,Iwashyna TJ; Christie JD; Moody J; Kahn JM; Asch DA,"RATIONALE: Moving patients from low-performing hospitals to high-performing hospitals may improve patient outcomes. These transfers may be particularly important in critical care, where small relative improvements can yield substantial absolute changes in survival. OBJECTIVE: To characterize the existing critical care network in terms of the pattern of transfers. METHODS: In a retrospective cohort study, the nationwide 2005 Medicare fee-for-service claims were used to identify the interhospital transfer of critically ill patients, defined as instances where patients used critical care services in 2 temporally adjacent hospitalizations. MEASUREMENTS: We measured the characteristics of the interhospital transfer network and the extent to which intensive care unit patients are referred to each hospital in that network--a continuous quantitative measure at the hospital-level known as centrality. We evaluated associations between hospital centrality and organizational, medical, surgical, and radiologic capabilities. RESULTS: There were 47,820 transfers of critically ill patients among 3308 hospitals. 4.5% of all critical care stays of any length involved an interhospital critical care transfer. Hospitals transferred out to a mean of 4.4 other hospitals. More central hospital positions were associated with multiple indicators of increased capability. Hospital characteristics explained 40.7% of the variance in hospitals' centrality. CONCLUSIONS: Critical care transfers are common, and traverse an informal but structured network. The centrality of a hospital is associated with increased capability in delivery of services, suggesting that existing transfers generally direct patients toward better resourced hospitals. Studies of this network promise further improvements in patient outcomes and efficiency of care.",2009,Jul,Med Care,47,7,787-93,,10.1097/MLR.0b013e318197b1f5,19536030,#342,Iwashyna 2009,"",""
Monitoring interhospital transfers in Western Greece during 2003-2011: its role in health policy.,Alexopoulos EC; Kalyva A; Merekoulias G; Niakas D,"INTRODUCTION: Interhospital transfers (ITs) could provide insight into regional healthcare efficiency and evidence for policy-making. The aim of this study was to analyse ITs carried out in the Western Greece region over a nine-year period. METHODS: Archives of the National Center of Emergency Medical Services of Patras and official healthcare resources were used to analyze patient transfers from rural to 'reception' hospitals in the area, during the period 2003-2011, by hospital, medical, seasonal and population variations. RESULTS: A total of 2500 ITs from the eight rural hospitals to the central ones in the metropolitan area of Patras were monitored yearly. Transfer rates per population ranged between less than 0.3% and more than 1.0%. Only a few patients transferred outside the area (0.9%). Almost 10% of total transfers regarded diagnostic evaluation (mostly CT scan). Transfer rates were inversely related to hospital admission rates (Pearson -0.973, p=0.027), while time (in minutes) (Pearson -0.903, =0.036) and distance (in kilometers) between the rural and central hospitals (Pearson -0.907, p=0.034) also exhibited significant relationships. The level of understaffing does not have a clear effect on ITs. CONCLUSIONS: By monitoring ITs, it becomes evident where efforts should be prioritized and which of the interconnections should be optimized in a specific network of health care. In this case, interventions should be focused towards the (a) very high transfer rates from the general hospital (GH) of Aigio, (b) lack of orthopedists at GH Kalavryta, which could provide a 24 hour emergency service in a tourist ski area, (c) understaffing in the microbiological laboratory and lack of a CT scanner at GH Mesologi, and (d) lack of radiologists in several hospitals, rendering the installed equipment worthless. By monitoring the ITs, real needs and win-win actions may emerge in the complex interplay of infrastructural factors.",2015,Oct-Dec,Rural Remote Health,15,4,3228,,,26458418,#356,Alexopoulos 2015,"",""
Evaluating Movement of Patients With Carbapenem-resistant Enterobacteriaceae Infections in the Greater Atlanta Metropolitan Area Using Social Network Analysis.,Bower CW; Fridkin DW; Wolford HM; Slayton RB; Kubes JN; Jacob JT; Ray SM; Fridkin SK,"BACKGROUND: Carbapenem-resistant Enterobacteriaceae (CRE) are an urgent threat with potential for rapid spread. We evaluated the role of Medicare patient movement between facilities to model the spread of CRE within a region. METHODS: Through population-based CRE surveillance in the 8-county Atlanta (GA) metropolitan area, all Escherichia coli, Enterobacter spp., or Klebsiella spp. resistant to ≥1 carbapenem were reported from residents. CRE was attributed to a facility based on timing of culture and facility exposures. Centrality metrics were calculated from 2016 Medicare data and compared to CRE-transfer derived centrality metrics by Spearman correlation. RESULTS: During 2016, 283 incident CRE cases with concurrent or prior year facility stays were identified; cases were attributed mostly to acute care hospitals (ACHs; 141, 50%) and skilled nursing facilities (SNFs; 113, 40%), and less frequently to long-term acute care hospitals (LTACHs; 29, 10%). Attribution was widespread, originating at 17 of 20 ACHs (85%), 7 of 8 (88%) LTACHs, but only 35 of 65 (54%) SNFs. Betweenness of Medicare patient transfers strongly correlated with betweenness of CRE case-transfer data in ACHs (r = 0.75; P < .01) and LTACHs (r = 0.77; P = .03), but not in SNFs (r = 0.02; P = 0.85). We noted 6 SNFs with high CRE-derived betweenness but low Medicare-derived betweenness. CONCLUSIONS: CRE infections originate from almost all ACHs and half of SNFs. We identified a subset of SNFs central to the CRE transfer network but not the Medicare transfer network; other factors may explain CRE patient movement in these facilities.",2020,Jan,Clin Infect Dis,70,1,75-81,,10.1093/cid/ciz154,30809636,#392,Bower 2020,"",""
Population genetic structuring of methicillin-resistant Staphylococcus aureus clone EMRSA-15 within UK reflects patient referral patterns.,Donker T; Reuter S; Scriberras J; Reynolds R; Brown NM; Török ME; James R; Network EOEMR; Aanensen DM; Bentley SD; Holden MTG; Parkhill J; Spratt BG; Peacock SJ; Feil EJ; Grundmann H,"Antibiotic resistance forms a serious threat to the health of hospitalised patients, rendering otherwise treatable bacterial infections potentially life-threatening. A thorough understanding of the mechanisms by which resistance spreads between patients in different hospitals is required in order to design effective control strategies. We measured the differences between bacterial populations of 52 hospitals in the United Kingdom and Ireland, using whole-genome sequences from 1085 MRSA clonal complex 22 isolates collected between 1998 and 2012. The genetic differences between bacterial populations were compared with the number of patients transferred between hospitals and their regional structure. The MRSA populations within single hospitals, regions and countries were genetically distinct from the rest of the bacterial population at each of these levels. Hospitals from the same patient referral regions showed more similar MRSA populations, as did hospitals sharing many patients. Furthermore, the bacterial populations from different time-periods within the same hospital were generally more similar to each other than contemporaneous bacterial populations from different hospitals. We conclude that, while a large part of the dispersal and expansion of MRSA takes place among patients seeking care in single hospitals, inter-hospital spread of resistant bacteria is by no means a rare occurrence. Hospitals are exposed to constant introductions of MRSA on a number of levels: (1) most MRSA is received from hospitals that directly transfer large numbers of patients, while (2) fewer introductions happen between regions or (3) across national borders, reflecting lower numbers of transferred patients. A joint coordinated control effort between hospitals, is therefore paramount for the national control of MRSA, antibiotic-resistant bacteria and other hospital-associated pathogens.",2017,Jul,Microb Genom,3,7,e000113,,10.1099/mgen.0.000113,29026654,#405,Donker 2017,"",""
